{"$schema":"https://json-schema.org/draft/2020-12/schema","additionalProperties":false,"properties":{"contractKind":{"const":"roadmap","type":"string"},"nodes":{"items":{"additionalProperties":false,"properties":{"blockedReasonCode":{"anyOf":[{"minLength":1,"type":"string"},{"type":"null"}]},"dependsOn":{"items":{"minLength":1,"type":"string"},"type":"array"},"humanAuthorityId":{"anyOf":[{"minLength":1,"type":"string"},{"type":"null"}]},"id":{"minLength":1,"type":"string"},"programId":{"minLength":1,"type":"string"},"requiredCapabilities":{"items":{"minLength":1,"type":"string"},"type":"array"},"state":{"enum":["draft","ready","running","produced","verifying","passed","failed","blocked","human-review-required","approved","closed"],"type":"string"},"taskPath":{"anyOf":[{"minLength":1,"type":"string"},{"type":"null"}]},"type":{"enum":["agent-task","human-gate","external-input"],"type":"string"}},"required":["id","programId","type","state","dependsOn","taskPath","requiredCapabilities","humanAuthorityId","blockedReasonCode"],"type":"object"},"type":"array"},"programs":{"items":{"additionalProperties":false,"properties":{"id":{"minLength":1,"type":"string"},"state":{"enum":["planned","in-progress","blocked","complete"],"type":"string"}},"required":["id","state"],"type":"object"},"minItems":1,"type":"array"},"roadmapId":{"minLength":1,"type":"string"},"schemaVersion":{"const":2,"type":"number"},"specHash":{"pattern":"^sha256:[a-f0-9]{64}$","type":"string"}},"required":["schemaVersion","contractKind","roadmapId","specHash","programs","nodes"],"type":"object"}