{"contractKind":"roadmap","nodes":[{"blockedReasonCode":null,"dependsOn":[],"humanAuthorityId":null,"id":"A-01","programId":"A","requiredCapabilities":[],"state":"verifying","taskPath":"continuity/tasks/program-a/A-01-primitives.task.json","type":"agent-task"},{"blockedReasonCode":null,"dependsOn":["A-01"],"humanAuthorityId":null,"id":"A-02","programId":"A","requiredCapabilities":[],"state":"verifying","taskPath":"continuity/tasks/program-a/A-02-contracts.task.json","type":"agent-task"},{"blockedReasonCode":null,"dependsOn":["A-02"],"humanAuthorityId":null,"id":"A-03","programId":"A","requiredCapabilities":[],"state":"verifying","taskPath":"continuity/tasks/program-a/A-03-state-roadmap.task.json","type":"agent-task"},{"blockedReasonCode":"VERIFIER_EVIDENCE_REQUIRED","dependsOn":["A-03"],"humanAuthorityId":null,"id":"A-04","programId":"A","requiredCapabilities":[],"state":"blocked","taskPath":"continuity/tasks/program-a/A-04-baseline.task.json","type":"agent-task"},{"blockedReasonCode":"VERIFIER_EVIDENCE_REQUIRED","dependsOn":["A-04"],"humanAuthorityId":null,"id":"A-05","programId":"A","requiredCapabilities":[],"state":"blocked","taskPath":"continuity/tasks/program-a/A-05-diff-guard.task.json","type":"agent-task"},{"blockedReasonCode":"VERIFIER_EVIDENCE_REQUIRED","dependsOn":["A-05"],"humanAuthorityId":null,"id":"A-06","programId":"A","requiredCapabilities":[],"state":"blocked","taskPath":"continuity/tasks/program-a/A-06-handoff.task.json","type":"agent-task"},{"blockedReasonCode":"VERIFIER_EVIDENCE_REQUIRED","dependsOn":["A-06"],"humanAuthorityId":null,"id":"A-07","programId":"A","requiredCapabilities":[],"state":"blocked","taskPath":"continuity/tasks/program-a/A-07-antigravity.task.json","type":"agent-task"},{"blockedReasonCode":"VERIFIER_EVIDENCE_REQUIRED","dependsOn":["A-06"],"humanAuthorityId":null,"id":"A-08","programId":"A","requiredCapabilities":[],"state":"blocked","taskPath":"continuity/tasks/program-a/A-08-gemini-v2.task.json","type":"agent-task"},{"blockedReasonCode":"VERIFIER_EVIDENCE_REQUIRED","dependsOn":["A-07","A-08"],"humanAuthorityId":null,"id":"A-09","programId":"A","requiredCapabilities":[],"state":"blocked","taskPath":"continuity/tasks/program-a/A-09-orchestrator-v2.task.json","type":"agent-task"},{"blockedReasonCode":"VERIFIER_EVIDENCE_REQUIRED","dependsOn":["A-09"],"humanAuthorityId":null,"id":"A-10","programId":"A","requiredCapabilities":[],"state":"blocked","taskPath":"continuity/tasks/program-a/A-10-recovery.task.json","type":"agent-task"},{"blockedReasonCode":"VERIFIER_EVIDENCE_REQUIRED","dependsOn":["A-10"],"humanAuthorityId":null,"id":"A-11","programId":"A","requiredCapabilities":[],"state":"blocked","taskPath":"continuity/tasks/program-a/A-11-conformance.task.json","type":"agent-task"},{"blockedReasonCode":null,"dependsOn":[],"humanAuthorityId":null,"id":"phase-00","programId":"A","requiredCapabilities":[],"state":"verifying","taskPath":null,"type":"external-input"},{"blockedReasonCode":null,"dependsOn":[],"humanAuthorityId":null,"id":"phase-01","programId":"A","requiredCapabilities":[],"state":"verifying","taskPath":null,"type":"external-input"},{"blockedReasonCode":null,"dependsOn":[],"humanAuthorityId":null,"id":"phase-02","programId":"A","requiredCapabilities":[],"state":"verifying","taskPath":null,"type":"external-input"},{"blockedReasonCode":null,"dependsOn":[],"humanAuthorityId":null,"id":"phase-03","programId":"A","requiredCapabilities":[],"state":"verifying","taskPath":null,"type":"external-input"},{"blockedReasonCode":null,"dependsOn":[],"humanAuthorityId":null,"id":"phase-04","programId":"A","requiredCapabilities":[],"state":"verifying","taskPath":null,"type":"external-input"},{"blockedReasonCode":"DESIGN_APPROVAL_REQUIRED","dependsOn":[],"humanAuthorityId":null,"id":"phase-05","programId":"B","requiredCapabilities":[],"state":"blocked","taskPath":null,"type":"external-input"},{"blockedReasonCode":"DESIGN_APPROVAL_REQUIRED","dependsOn":[],"humanAuthorityId":null,"id":"phase-06","programId":"B","requiredCapabilities":[],"state":"blocked","taskPath":null,"type":"external-input"},{"blockedReasonCode":"DESIGN_APPROVAL_REQUIRED","dependsOn":[],"humanAuthorityId":null,"id":"phase-07","programId":"C","requiredCapabilities":[],"state":"blocked","taskPath":null,"type":"external-input"},{"blockedReasonCode":"DESIGN_APPROVAL_REQUIRED","dependsOn":[],"humanAuthorityId":null,"id":"phase-08","programId":"C","requiredCapabilities":[],"state":"blocked","taskPath":null,"type":"external-input"},{"blockedReasonCode":"DESIGN_APPROVAL_REQUIRED","dependsOn":[],"humanAuthorityId":null,"id":"phase-09","programId":"D","requiredCapabilities":[],"state":"blocked","taskPath":null,"type":"external-input"},{"blockedReasonCode":"DESIGN_APPROVAL_REQUIRED","dependsOn":[],"humanAuthorityId":null,"id":"phase-10","programId":"D","requiredCapabilities":[],"state":"blocked","taskPath":null,"type":"external-input"},{"blockedReasonCode":"DESIGN_APPROVAL_REQUIRED","dependsOn":[],"humanAuthorityId":null,"id":"phase-11","programId":"D","requiredCapabilities":[],"state":"blocked","taskPath":null,"type":"external-input"},{"blockedReasonCode":"DESIGN_APPROVAL_REQUIRED","dependsOn":[],"humanAuthorityId":null,"id":"phase-12","programId":"E","requiredCapabilities":[],"state":"blocked","taskPath":null,"type":"external-input"},{"blockedReasonCode":"DESIGN_APPROVAL_REQUIRED","dependsOn":[],"humanAuthorityId":null,"id":"phase-13","programId":"E","requiredCapabilities":[],"state":"blocked","taskPath":null,"type":"external-input"},{"blockedReasonCode":"DESIGN_APPROVAL_REQUIRED","dependsOn":[],"humanAuthorityId":null,"id":"phase-14","programId":"E","requiredCapabilities":[],"state":"blocked","taskPath":null,"type":"external-input"}],"programs":[{"id":"A","state":"in-progress"},{"id":"B","state":"blocked"},{"id":"C","state":"blocked"},{"id":"D","state":"blocked"},{"id":"E","state":"blocked"}],"roadmapId":"studio-dna-phase-0-14","schemaVersion":2,"specHash":"sha256:79570098f0a736ee636cdd5956fec2e728c97eed8f230957880d3f5c708c0a8c"}